userId,name,email,title
9,Glenna Reichert,Chaim_McDermott@dana.io,tempora rem veritatis voluptas quo dolores vero
9,Glenna Reichert,Chaim_McDermott@dana.io,laudantium voluptate suscipit sunt enim enim
9,Glenna Reichert,Chaim_McDermott@dana.io,odit et voluptates doloribus alias odio et
9,Glenna Reichert,Chaim_McDermott@dana.io,optio ipsam molestias necessitatibus occaecati facilis veritatis dolores aut
9,Glenna Reichert,Chaim_McDermott@dana.io,dolore veritatis porro provident adipisci blanditiis et sunt
9,Glenna Reichert,Chaim_McDermott@dana.io,placeat quia et porro iste
9,Glenna Reichert,Chaim_McDermott@dana.io,nostrum quis quasi placeat
9,Glenna Reichert,Chaim_McDermott@dana.io,sapiente omnis fugit eos
9,Glenna Reichert,Chaim_McDermott@dana.io,sint soluta et vel magnam aut ut sed qui
9,Glenna Reichert,Chaim_McDermott@dana.io,ad iusto omnis odit dolor voluptatibus
4,Patricia Lebsack,Julianne.OConner@kory.org,ullam ut quidem id aut vel consequuntur
4,Patricia Lebsack,Julianne.OConner@kory.org,doloremque illum aliquid sunt
4,Patricia Lebsack,Julianne.OConner@kory.org,qui explicabo molestiae dolorem
4,Patricia Lebsack,Julianne.OConner@kory.org,magnam ut rerum iure
4,Patricia Lebsack,Julianne.OConner@kory.org,id nihil consequatur molestias animi provident
4,Patricia Lebsack,Julianne.OConner@kory.org,fuga nam accusamus voluptas reiciendis itaque
4,Patricia Lebsack,Julianne.OConner@kory.org,provident vel ut sit ratione est
4,Patricia Lebsack,Julianne.OConner@kory.org,explicabo et eos deleniti nostrum ab id repellendus
4,Patricia Lebsack,Julianne.OConner@kory.org,eos dolorem iste accusantium est eaque quam
4,Patricia Lebsack,Julianne.OConner@kory.org,enim quo cumque
6,Mrs. Dennis Schulist,Karley_Dach@jasper.info,soluta aliquam aperiam consequatur illo quis voluptas
6,Mrs. Dennis Schulist,Karley_Dach@jasper.info,qui enim et consequuntur quia animi quis voluptate quibusdam
6,Mrs. Dennis Schulist,Karley_Dach@jasper.info,ut quo aut ducimus alias
6,Mrs. Dennis Schulist,Karley_Dach@jasper.info,sit asperiores ipsam eveniet odio non quia
6,Mrs. Dennis Schulist,Karley_Dach@jasper.info,sit vel voluptatem et non libero
6,Mrs. Dennis Schulist,Karley_Dach@jasper.info,qui et at rerum necessitatibus
6,Mrs. Dennis Schulist,Karley_Dach@jasper.info,sed ab est est
6,Mrs. Dennis Schulist,Karley_Dach@jasper.info,voluptatum itaque dolores nisi et quasi
6,Mrs. Dennis Schulist,Karley_Dach@jasper.info,qui commodi dolor at maiores et quis id accusantium
6,Mrs. Dennis Schulist,Karley_Dach@jasper.info,consequatur placeat omnis quisquam quia reprehenderit fugit veritatis facere
5,Chelsey Dietrich,Lucio_Hettinger@annie.ca,non est facere
5,Chelsey Dietrich,Lucio_Hettinger@annie.ca,commodi ullam sint et excepturi error explicabo praesentium voluptas
5,Chelsey Dietrich,Lucio_Hettinger@annie.ca,eligendi iste nostrum consequuntur adipisci praesentium sit beatae perferendis
5,Chelsey Dietrich,Lucio_Hettinger@annie.ca,optio dolor molestias sit
5,Chelsey Dietrich,Lucio_Hettinger@annie.ca,ut numquam possimus omnis eius suscipit laudantium iure
5,Chelsey Dietrich,Lucio_Hettinger@annie.ca,aut quo modi neque nostrum ducimus
5,Chelsey Dietrich,Lucio_Hettinger@annie.ca,quibusdam cumque rem aut deserunt
5,Chelsey Dietrich,Lucio_Hettinger@annie.ca,ut voluptatem illum ea doloribus itaque eos
5,Chelsey Dietrich,Lucio_Hettinger@annie.ca,laborum non sunt aut ut assumenda perspiciatis voluptas
5,Chelsey Dietrich,Lucio_Hettinger@annie.ca,repellendus qui recusandae incidunt voluptates tenetur qui omnis exercitationem
3,Clementine Bauch,Nathan@yesenia.net,asperiores ea ipsam voluptatibus modi minima quia sint
3,Clementine Bauch,Nathan@yesenia.net,dolor sint quo a velit explicabo quia nam
3,Clementine Bauch,Nathan@yesenia.net,maxime id vitae nihil numquam
3,Clementine Bauch,Nathan@yesenia.net,autem hic labore sunt dolores incidunt
3,Clementine Bauch,Nathan@yesenia.net,rem alias distinctio quo quis
3,Clementine Bauch,Nathan@yesenia.net,est et quae odit qui non
3,Clementine Bauch,Nathan@yesenia.net,quasi id et eos tenetur aut quo autem
3,Clementine Bauch,Nathan@yesenia.net,delectus ullam et corporis nulla voluptas sequi
3,Clementine Bauch,Nathan@yesenia.net,iusto eius quod necessitatibus culpa ea
3,Clementine Bauch,Nathan@yesenia.net,a quo magni similique perferendis
10,Clementina Dubuque,Rey.Padberg@karina.biz,aut amet sed
10,Clementina Dubuque,Rey.Padberg@karina.biz,ratione ex tenetur perferendis
10,Clementina Dubuque,Rey.Padberg@karina.biz,beatae soluta recusandae
10,Clementina Dubuque,Rey.Padberg@karina.biz,qui qui voluptates illo iste minima
10,Clementina Dubuque,Rey.Padberg@karina.biz,id minus libero illum nam ad officiis
10,Clementina Dubuque,Rey.Padberg@karina.biz,quaerat velit veniam amet cupiditate aut numquam ut sequi
10,Clementina Dubuque,Rey.Padberg@karina.biz,quas fugiat ut perspiciatis vero provident
10,Clementina Dubuque,Rey.Padberg@karina.biz,laboriosam dolor voluptates
10,Clementina Dubuque,Rey.Padberg@karina.biz,temporibus sit alias delectus eligendi possimus magni
10,Clementina Dubuque,Rey.Padberg@karina.biz,at nam consequatur ea labore ea harum
2,Ervin Howell,Shanna@melissa.tv,et ea vero quia laudantium autem
2,Ervin Howell,Shanna@melissa.tv,in quibusdam tempore odit est dolorem
2,Ervin Howell,Shanna@melissa.tv,dolorum ut in voluptas mollitia et saepe quo animi
2,Ervin Howell,Shanna@melissa.tv,voluptatem eligendi optio
2,Ervin Howell,Shanna@melissa.tv,eveniet quod temporibus
2,Ervin Howell,Shanna@melissa.tv,sint suscipit perspiciatis velit dolorum rerum ipsa laboriosam odio
2,Ervin Howell,Shanna@melissa.tv,fugit voluptas sed molestias voluptatem provident
2,Ervin Howell,Shanna@melissa.tv,voluptate et itaque vero tempora molestiae
2,Ervin Howell,Shanna@melissa.tv,adipisci placeat illum aut reiciendis qui
2,Ervin Howell,Shanna@melissa.tv,doloribus ad provident suscipit at
8,Nicholas Runolfsdottir V,Sherwood@rosamond.me,et iusto veniam et illum aut fuga
8,Nicholas Runolfsdottir V,Sherwood@rosamond.me,sint hic doloribus consequatur eos non id
8,Nicholas Runolfsdottir V,Sherwood@rosamond.me,consequuntur deleniti eos quia temporibus ab aliquid at
8,Nicholas Runolfsdottir V,Sherwood@rosamond.me,enim unde ratione doloribus quas enim ut sit sapiente
8,Nicholas Runolfsdottir V,Sherwood@rosamond.me,dignissimos eum dolor ut enim et delectus in
8,Nicholas Runolfsdottir V,Sherwood@rosamond.me,doloremque officiis ad et non perferendis
8,Nicholas Runolfsdottir V,Sherwood@rosamond.me,necessitatibus quasi exercitationem odio
8,Nicholas Runolfsdottir V,Sherwood@rosamond.me,quam voluptatibus rerum veritatis
8,Nicholas Runolfsdottir V,Sherwood@rosamond.me,pariatur consequatur quia magnam autem omnis non amet
8,Nicholas Runolfsdottir V,Sherwood@rosamond.me,labore in ex et explicabo corporis aut quas
1,Leanne Graham,Sincere@april.biz,sunt aut facere repellat provident occaecati excepturi optio reprehenderit
1,Leanne Graham,Sincere@april.biz,qui est esse
1,Leanne Graham,Sincere@april.biz,ea molestias quasi exercitationem repellat qui ipsa sit aut
1,Leanne Graham,Sincere@april.biz,eum et est occaecati
1,Leanne Graham,Sincere@april.biz,nesciunt quas odio
1,Leanne Graham,Sincere@april.biz,dolorem eum magni eos aperiam quia
1,Leanne Graham,Sincere@april.biz,magnam facilis autem
1,Leanne Graham,Sincere@april.biz,dolorem dolore est ipsam
1,Leanne Graham,Sincere@april.biz,nesciunt iure omnis dolorem tempora et accusantium
1,Leanne Graham,Sincere@april.biz,optio molestias id quia eum
7,Kurtis Weissnat,Telly.Hoeger@billy.biz,voluptatem doloribus consectetur est ut ducimus
7,Kurtis Weissnat,Telly.Hoeger@billy.biz,beatae enim quia vel
7,Kurtis Weissnat,Telly.Hoeger@billy.biz,voluptas blanditiis repellendus animi ducimus error sapiente et suscipit
7,Kurtis Weissnat,Telly.Hoeger@billy.biz,et fugit quas eum in in aperiam quod
7,Kurtis Weissnat,Telly.Hoeger@billy.biz,consequatur id enim sunt et et
7,Kurtis Weissnat,Telly.Hoeger@billy.biz,repudiandae ea animi iusto
7,Kurtis Weissnat,Telly.Hoeger@billy.biz,aliquid eos sed fuga est maxime repellendus
7,Kurtis Weissnat,Telly.Hoeger@billy.biz,odio quis facere architecto reiciendis optio
7,Kurtis Weissnat,Telly.Hoeger@billy.biz,fugiat quod pariatur odit minima
7,Kurtis Weissnat,Telly.Hoeger@billy.biz,voluptatem laborum magni
0,Lucky Shrestha,lucky.shrestha@example.com,N/A
